{
  "name": "obstacle_course",
  "gravity": [0, -9.81, 0],
  "ground": {
    "type": "plane",
    "friction": 0.5,
    "restitution": 0.1
  },
  "objects": [
    {
      "name": "wall_left",
      "type": "wall",
      "size": [0.2, 1.0, 20.0],
      "position": [-5.0, 0.5, 0.0],
      "mass": 0,
      "friction": 0.5
    },
    {
      "name": "wall_right",
      "type": "wall",
      "size": [0.2, 1.0, 20.0],
      "position": [5.0, 0.5, 0.0],
      "mass": 0,
      "friction": 0.5
    },
    {
      "name": "box_obstacle_1",
      "type": "box",
      "size": [1.0, 0.5, 1.0],
      "position": [2.0, 0.25, 3.0],
      "mass": 0,
      "friction": 0.5
    },
    {
      "name": "box_obstacle_2",
      "type": "box",
      "size": [1.5, 0.3, 0.5],
      "position": [-1.5, 0.15, 5.0],
      "mass": 0,
      "friction": 0.5
    },
    {
      "name": "box_obstacle_3",
      "type": "box",
      "size": [0.8, 0.8, 0.8],
      "position": [0.0, 0.4, 8.0],
      "mass": 0,
      "friction": 0.5
    },
    {
      "name": "ramp_1",
      "type": "ramp",
      "length": 3.0,
      "slope": 10,
      "position": [0.0, 0.3, 12.0],
      "friction": 0.6
    },
    {
      "name": "cylinder_obstacle",
      "type": "cylinder",
      "size": [0.4, 0.8],
      "position": [-2.0, 0.4, 15.0],
      "mass": 0,
      "friction": 0.5
    },
    {
      "name": "dynamic_box",
      "type": "box",
      "size": [0.4, 0.4, 0.4],
      "position": [1.0, 2.0, 6.0],
      "mass": 2.0,
      "friction": 0.5
    }
  ],
  "robot_spawn": [0, 0.5, 0]
}
